term,definition
"Name the 8 Limbs of Yoga","Yama, Niyama, Asana, Pranayama, Pratyahara, Dharana, Dhyana, Samadhi"
"Yama (1st Limb)","Ethical restraints governing behavior toward others: non-violence (Ahimsa), truthfulness (Satya), non-stealing (Asteya), continence (Brahmacharya), non-possessiveness (Aparigraha)"
"Niyama (2nd Limb)","Personal observances and self-disciplines: cleanliness (Saucha), contentment (Santosha), austerity (Tapas), self-study (Svadhyaya), surrender to the divine (Ishvara Pranidhana)"
"Asana (3rd Limb)","Physical postures; cultivating steadiness and ease in the body, preparing it for deeper practice"
"Pranayama (4th Limb)","Breath control; regulation and extension of prana (life force) through breathing techniques"
"Pratyahara (5th Limb)","Withdrawal of the senses; drawing awareness inward and away from external stimuli"
"Dharana (6th Limb)","Concentration; sustained, focused attention on a single point or object"
"Dhyana (7th Limb)","Meditation; unbroken, continuous flow of concentration leading toward absorption"
"Samadhi (8th Limb)","Blissful absorption; complete union with the object of meditation; enlightenment"
"Name the 8 Ashtanga Drishti","Nasagrai, Bhrumadhya, Nabi Chakra, Hastagrai, Padhayoragrai, Parsva, Angusta Ma Dyai, Urdhva"
"Nasagrai","Drishti: gaze fixed at the tip of the nose"
"Bhrumadhya","Drishti: gaze fixed at the third eye center, between the eyebrows (Ajna Chakra)"
"Nabi Chakra","Drishti: gaze fixed at the navel center"
"Hastagrai","Drishti: gaze fixed at the hand or fingertips"
"Padhayoragrai","Drishti: gaze fixed at the tips of the toes or feet"
"Parsva","Drishti: gaze fixed far to the side (right or left)"
"Angusta Ma Dyai","Drishti: gaze fixed at the thumbs"
"Urdhva","Drishti: gaze fixed upward toward the sky"
"Name the 4 Ligaments of the Knee","Anterior Cruciate Ligament (ACL), Posterior Cruciate Ligament (PCL), Lateral Collateral Ligament (LCL), Medial Collateral Ligament (MCL)"
"Name the 9 Anatomical Movements","Flexion, Extension, Adduction, Abduction, Pronation, Supination, Rotation, Dorsiflexion, Plantar Flexion"
"Flexion","Decreasing the angle between two body parts by bending a joint (e.g., bending the knee or elbow)"
"Extension","Increasing the angle between two body parts by straightening a joint (e.g., straightening the knee or elbow)"
"Adduction","Movement of a limb toward the midline of the body"
"Abduction","Movement of a limb away from the midline of the body"
"Pronation","Rotation of the forearm so the palm faces downward; also refers to inward rolling of the foot/ankle"
"Supination","Rotation of the forearm so the palm faces upward; also refers to outward rolling of the foot/ankle"
"Rotation","Movement of a body part around its own longitudinal axis"
"Dorsiflexion","Flexion of the foot upward toward the shin, decreasing the angle at the ankle joint"
"Plantar Flexion","Extension of the foot downward away from the shin (pointing the toes), increasing the angle at the ankle joint"
"Benefits of Triangle Pose (Trikonasana)","Stretches hamstrings, groins, hips, IT band, and spine; strengthens thighs, knees, and ankles; opens chest and shoulders; stimulates abdominal organs; improves digestion; relieves back pain and sciatica; builds balance and stability; reduces stress and anxiety"
"3–4 Prep Exercises for Downward Dog — and why","1. Cat-Cow: warms the spine, mobilizes wrists and shoulders; 2. Plank Pose: builds the shoulder stability and core strength needed to hold DD; 3. Puppy Pose (Uttana Shishosana): opens upper back and stretches lats, mimicking DD arm extension; 4. Standing Forward Fold (Uttanasana): lengthens hamstrings and calves, easing the posterior chain tension that prevents heels from grounding"
"Name the 9 Obstacles to Yoga Sadhana (Antarayas)","Vyadhi, Styana, Samshaya, Pramada, Alasya, Avirati, Bhranti Darshana, Alabdha Bhumikatva, Anavasthitatva"
"Vyadhi","Antaraya: physical disease or ailment (e.g., chronic pain) that disrupts practice"
"Styana (Stayana)","Antaraya: mental dullness or lack of interest; apathy toward practice"
"Samshaya (Sanshaya)","Antaraya: doubt; uncertainty about the path or one's own capability"
"Pramada","Antaraya: carelessness or procrastination; neglecting consistent practice"
"Alasya (Aalasya)","Antaraya: physical laziness; heaviness of body that resists effort"
"Avirati","Antaraya: craving of the senses; inability to detach from sensory pleasures"
"Bhranti Darshana","Antaraya: false perception or misconception; deluded understanding of the practice or self"
"Alabdha Bhumikatva (Alabdha Bhoomi)","Antaraya: failure to attain the ground of higher practice; unable to reach advanced stages"
"Anavasthitatva (Anavasthit Tattva)","Antaraya: inability to maintain or stabilize attainments; falling back from achieved states"
"Name the 6 Requirements of Pranayama","Asana, Kumbhaka, Mudra, Bandha, Dhyana, Mantra"
"Asana (Pranayama requirement)","Stable, comfortable posture that allows free breath movement and sustained concentration"
"Kumbhaka (Pranayama requirement)","Breath retention; holding the breath after inhalation (antara kumbhaka) or after exhalation (bahya kumbhaka)"
"Mudra (Pranayama requirement)","Gestures or ""mental attitudes"" that redirect prana; 108 mudras are available"
"Bandha (Pranayama requirement)","Energy locks that contain and direct prana (e.g., Mula Bandha, Uddiyana Bandha, Jalandhara Bandha)"
"Dhyana (Pranayama requirement)","Awareness; directing focused attention to a specific chakra or internal focal point during practice"
"Mantra (Pranayama requirement)","Mental chant used to tame and focus the mind during pranayama practice"
"Name the 5 Elements (Panchamahabhuta) in Order","Space (Akasha), Air (Vayu), Fire (Agni), Water (Jala), Earth (Prithvi)"
"Name the 12 Steps of Hatha Yoga Surya Namaskar (Bihar School)","Pranamasana, Hasta Uttanasana, Padhastasana, Ashwa Sanchalanasana, Parvatasana, Ashtanga Namaskara, Bhujangasana, Parvatasana, Ashwa Sanchalanasana, Padhastasana, Hasta Uttanasana, Pranamasana"
"Pranamasana","Surya Namaskar — Step 1 | Exhale; stand with hands in prayer position at the heart"
"Hasta Uttanasana","Surya Namaskar — Step 2 | Inhale; raise arms overhead with a slight backbend"
"Padhastasana","Surya Namaskar — Step 3 | Exhale; fold forward, hands touching the floor beside the feet"
"Ashwa Sanchalanasana","Surya Namaskar — Step 4 | Inhale; step the left leg back into a low lunge, gaze forward"
"Parvatasana (Step 5)","Surya Namaskar — Step 5 | Exhale; step the right leg back and raise the hips into Downward Dog (Mountain Pose)"
"Ashtanga Namaskara","Surya Namaskar — Step 6 | Same breath (no new inhale); lower knees, chest, and chin to the ground — eight-limbed salutation"
"Bhujangasana","Surya Namaskar — Step 7 | Inhale; slide forward and lift the chest into Cobra Pose"
"Parvatasana (Step 8)","Surya Namaskar — Step 8 | Exhale; press back into Downward Dog (Mountain Pose)"
"Ashwa Sanchalanasana (Step 9)","Surya Namaskar — Step 9 | Inhale; step the left leg forward into a low lunge"
"Padhastasana (Step 10)","Surya Namaskar — Step 10 | Exhale; step the right leg forward into a standing forward fold"
"Hasta Uttanasana (Step 11)","Surya Namaskar — Step 11 | Inhale; sweep arms up overhead with a slight backbend"
"Pranamasana (Step 12)","Surya Namaskar — Step 12 | Exhale; return hands to prayer position at the heart (repeat with opposite legs)"
"What is an Asana?","Sthiran Sukham Asanam — a posture that is stable (physically and emotionally) and comfortable, with correct alignment (Yoga Sutras II.46)"
"Name the 4 Types of Yoga","Jnana Yoga, Bhakti Yoga, Karma Yoga, Raja Yoga"
"Jnana Yoga","Path of knowledge and wisdom; liberation through study, self-inquiry, and discernment between the real and unreal"
"Bhakti Yoga","Path of devotion; liberation through love, surrender, and worship of the divine"
"Karma Yoga","Path of selfless action; liberation through service performed without attachment to results"
"Raja Yoga","The royal path; liberation through meditation and the 8 limbs of Patanjali's Ashtanga system"
"Name the 6 Astika Schools (Orthodox Hindu Philosophy)","Nyaya, Vaisheshika, Samkhya, Yoga, Mimamsa (Purva Mimamsa), Vedanta (Uttara Mimamsa)"
"Nyaya (Astika)","Orthodox school of logic and epistemology; establishes the four valid means of knowledge (Pramanas)"
"Vaisheshika (Astika)","Orthodox school of atomism; categorizes all reality into substances, qualities, and actions"
"Samkhya (Astika)","Orthodox dualistic school; enumerates 25 tattvas arising from Purusha (pure consciousness) and Prakriti (matter)"
"Yoga (Astika)","Orthodox school of Patanjali; practical 8-limbed path to liberate Purusha from Prakriti through discipline and meditation"
"Mimamsa / Purva Mimamsa (Astika)","Orthodox school of Vedic ritual interpretation; emphasizes correct performance of dharma and sacrificial rites"
"Vedanta / Uttara Mimamsa (Astika)","Orthodox school exploring the nature of Brahman; encompasses Advaita (non-dualism), Dvaita (dualism), and Vishishtadvaita among others"
"Name the 3 Nastika Schools (Heterodox Philosophy)","Buddhism, Jainism, Charvaka"
"Buddhism (Nastika)","Heterodox school founded by Siddhartha Gautama; rejects Vedic authority; teaches the Four Noble Truths, Eightfold Path, impermanence, and no-self (anatta)"
"Jainism (Nastika)","Heterodox school associated with Mahavira; rejects Vedic authority; teaches ahimsa, anekantavada (non-absolutism), and liberation through non-attachment"
"Charvaka (Nastika)","Heterodox materialist school; rejects the Vedas and all metaphysics; holds that only direct perception (pratyaksha) is valid knowledge"
"Name the 3 Doshas","Vata, Pitta, Kapha"
"Vata (Dosha)","Composed of air (Vayu) and space (Akasha); governs movement, creativity, and the nervous system; imbalance manifests as anxiety, dryness, and irregular digestion"
"Pitta (Dosha)","Composed of fire (Agni) and water (Jala); governs transformation, digestion, and metabolism; imbalance manifests as anger, inflammation, and overheating"
"Kapha (Dosha)","Composed of earth (Prithvi) and water (Jala); governs stability, lubrication, and structure; imbalance manifests as lethargy, congestion, and weight gain"
"Name the 5 Yamas","Ahimsa, Satya, Asteya, Brahmacharya, Aparigraha"
"Ahimsa (Yama)","Non-violence; refraining from harm in thought, word, and deed toward all living beings"
"Satya (Yama)","Truthfulness; alignment of thought, speech, and action with truth"
"Asteya (Yama)","Non-stealing; not taking what has not been freely given, including time, ideas, or energy"
"Brahmacharya (Yama)","Right use of energy or continence; traditionally celibacy; broadly the conservation and redirection of vital energy away from sensory indulgence"
"Aparigraha (Yama)","Non-possessiveness; not hoarding; taking only what is necessary and releasing attachment to outcomes"
"Name the 6 Shatkarma (Shat Kriyas)","Dhauti, Basti, Neti, Nauli, Trataka, Kapalabhati"
"Dhauti (Shatkarma)","Internal cleansing; 13 types including voluntary vomiting (Kunjal Kriya) and cloth swallowing (Vastra Dhauti); purifies the digestive tract"
"Basti (Shatkarma)","Yogic enema; cleansing of the colon using water; removes waste and balances Apana Vayu"
"Neti (Shatkarma)","Nasal passage cleansing; Jala Neti uses warm saline water; Sutra Neti uses a waxed thread; clears sinuses and supports pranayama"
"Nauli (Shatkarma)","Abdominal massage through isolation and churning of the rectus abdominis; massages internal organs and stimulates digestive fire (Agni)"
"Trataka (Shatkarma)","One-pointed gazing, typically at a candle flame without blinking; purifies and strengthens the eyes; develops concentration (Dharana)"
"Kapalabhati (Shatkarma)","Skull-shining breath; forceful rapid exhalations with passive inhalations; cleanses the respiratory tract and energizes the mind"
"Anta Karna (Antahkarana)","The inner instrument; the fourfold internal faculty through which consciousness operates: Mana, Buddhi, Citta, Ahamkara"
"Name the 4 Components of Anta Karna (Antahkarana)","Mana, Buddhi, Citta, Ahamkara"
"Mana (Anta Karna)","The indecisive mind; receives and processes sensory input; generates doubts and mental fluctuations (vrittis)"
"Buddhi (Anta Karna)","The intellect; the decisive faculty; discerns, determines, and provides clarity and wisdom"
"Citta (Anta Karna)","Memory and the subconscious; the storehouse of impressions (samskaras) and past experiences"
"Ahamkara (Anta Karna)","The ego; the ""I""-maker; creates the sense of individual identity, ownership, and doership"
"Define Yoga","Yoga citta vritti nirodha — yoga is the cessation of fluctuations of the mind"
"Define Hatha Yoga","Traditional and foundational branch of yoga combining asanas, pranayama, and meditation to balance mind and body"
"Benefits of Surya Namaskar","A connected series of asanas with synchronized breath that functions as moving meditation; benefits include improved focus and reduced anxiety, depression, stress responses, and insomnia"